id;champion_name;association_to_offender;message_count;first_time;last_time;label;message;first_id;last_id;chatlog_id
41;Kayle;enemy;16;00:10:21;00:44:12;1;ulti ji ss ss i need blu thx trima report trimadere good noob jix fuck team no report trimadere report trimadere pls no play team no solo noobssss #NAME? report trimadere pls for noobs report trima;41;41;10034
41;Nautilus;ally;2;00:38:26;00:42:50;0;u mean papa ^^ ?;41;41;10034
41;Sivir;enemy;32;00:00:45;00:44:04;1;glhf wait gjk oom kayle :C fu tryn gj NOOOOOOO --'p WTF gj o.O WHHHAAAAAAAAAAAAAAAAAAAAAAAAAT teemo's too much feed go focus teemo guys this teeemo .. NEED PLS pls yeai thanks focus TEEMO gj omw top :c PLAY IN WITH TEAM TRYNDA --- pdv .. GO DEFEND ALL go depush yep .. FOCUS THIS FU CKING TEEMO GUYS ggw;41;41;10034
41;Teemo;ally;67;00:00:36;00:44:05;1;gl and hf plang xD good man go lvl ? 3 really ? smurf amumi gank --' tryndamere gank 5 .. amumu 0 it's ,not a gank take creep in mid ... gg omg gankplank gank boot gg go top amumu omg no gg omg bo no why NOOOB THIS FEED UDYR FUCK SURRENDER . all mid we win gg gank plank go all miud plz WAUT AKK WAIT ALL wait all akl mid we win . xD all top wait all bot BACK gg jinx go back go with all go nashor wait fr france i'm gay and ? what's up ? relation with male wait me all . WAIT ME ALL WE WIN i'm feed xD love you <3;41;41;10034
41;Tryndamere;enemy;10;00:00:29;00:43:21;0;can you people help me with red? ty awesome ty gj for what? focus jinx less health why report? FKING MUSHROOMS thank you very much;41;41;10034
41;Udyr;enemy;12;00:03:53;00:42:47;0;gj ss Ty for? ss ok who? gj trynda omg play with team fckking shrooms;41;41;10034
42;Caitlyn;enemy;36;00:02:15;00:45:05;1;thats racist dont attack the miniions stop touching the minions np ty fuuuk oom k wow y but dat was quite unexpected worth? they got a nice shutdown... why are they so bad all of a sudden? dat double luck tho its a trap! im playing poorly sry gjgj sry and now in english i only understood stupid nut i dont feel insulted by 'stupid nut' weel im a prostitute can i? i already had one gj wp push gj dammit ^^ lux wtf? items Gg;42;42;10035
42;Ezreal;enemy;12;00:02:06;00:45:06;1;sry boy but gj ward I think need fking blue you suck bit.ch not nut.. nutte = b.itch no my pls need it omg dat op gg;42;42;10035
42;Jinx;offender;11;00:01:52;00:44:24;0;ese alez lol lag.. sorry na surrender kayle afj leona all mid na surrender 6 down;42;42;10035
42;Kayle;ally;1;00:13:38;00:13:38;0;ss;42;42;10035
42;Leona;ally;3;00:39:23;00:43:48;0;noo go jinx!;42;42;10035
42;Lux;enemy;26;00:06:02;00:45:09;0;damn it sry im gone :O i said i was gone np nice lol Dat Gank can i get it noo AAAAAAAAAAAAAAAAAAARRRRRRRRRRRRRRRRRRRRRRRRRRGGGGGGGGGGGGGGGGGGGGGGGGGGGHHHHHHHHHHHHHHHHHHHHHHHH im tank now HAHAHAHAHAHh sry fail buy 3 times HG g gf ghf dfz fd fd fg gfd dfg gf;42;42;10035
42;Nidalee;enemy;10;00:06:35;00:45:06;1;ss re gj ss ss ss cait stop stealing man u suck tx gg;42;42;10035
42;Udyr;enemy;8;00:06:21;00:45:05;1;HAHAHA ezreal ult jinx gg 3vs1 come on niggaz OMFG DEF HAHHA;42;42;10035
42;Vi;ally;1;00:08:26;00:08:26;0;esq estoy cenando sans;42;42;10035
43;Fiddlesticks;ally;20;00:13:41;00:46:54;1;lol shaco focus supp^^ nice^^ 0 help from garen and garen back all time to late for tf lol nice tank garen 0 dmg and flame!!!stfu noob you flame all time only noobs flame so stupid mf??? garen back omg so stupid gays lol stfu def noob;43;43;10036
43;Garen;ally;29;00:00:34;00:47:19;1;smiteless! pull the blue hehe waow gank man go together omg ward baron -.- ye miss fortun no adc okey :P and ? then its your first time yee baron haha waow start  suck man im carry this game do you think i care about you ? pff this teak -.- gg fkn nobb noob hehehe taht ulti 0 barin -.-;43;43;10036
43;Kassadin;ally;16;00:00:48;00:48:24;0;now? ok why? wow gj yi mid he is level 4 push mid wu alive lets all build armor def man stop talking garen and mf backdoor? then we lost not if u backdoot pls report mf;43;43;10036
43;Leona;enemy;3;00:15:32;00:45:58;1;push bot hahaha garen , go home;43;43;10036
43;Master Yi;enemy;7;00:25:25;00:35:05;0;why ? solo is bad. . in team pls .. -_- report him help for other team like a little girl ...;43;43;10036
43;Miss Fortune;offender;114;00:01:36;00:48:26;1;good dont need man ... he is shaco fuckk man now starT? take kills? more 1 steel and i go afk -.- 0 hep wtff omfg now .. always 4 bot omfg impossible win ... why what? focus talon and yi omfg 5 assists g -.- surrender why what man -.- surreender -.- yi feed talon feed what are you doing nowï¿½ï¿½ ? -.- surrender man -.- look mtoherfuckker build of garen LOOOK we dont have tank surrender this -.- togetehjr what noob? look your build? we no have tank wtff -.- never see this omfg 0 help wtfff FUCKKING TEAM you are retardad you no look for map noob -.- surrender this noobs 0 wards 0 tanks loool garen pls sell ininity and buy armor heal ... -.- go and back go and back thids mf what noob garen you no comment pls AND SELL INFINTY -.- wait for my ulti omg you no see map? -.- ... teamm more noob ever yea man i dont understand yours atitudes shut up push now gogog garen 0 tanks -.- look your build man i never see this yea man and you no tank ... why buy inifity? wtff i never see this man wtff lool 1on1 after? STOP TALK more dmg garen? wtff you reallys sick HAHAHH carry? we dont have tanks gg man NO -.- look 0 help he no see nothing MAN YOU ARE STUPID TEHY FOCUS ME AND I NO HAVE CHANCE -.- noob man cause i have noob team no protect adc retardad finish this -.- finish pls gg look no help omg no srlsl -.- shut up noos is you lool look your build noob look build garen so pro shaco more tank than garen -.. look this noob tema ahhaha gogogo and we lose nooobs retardads dont need defend noobs lool ahhaa never for die? yea we lost gg gg bad gareneve;43;43;10036
43;Shaco;ally;44;00:00:25;00:48:28;1;just cover blue nop im gonna take red y stay bluye nop garen lol maybe  follow go to our red garen yi is here thx dont steal jungle pls well... fuck pink ward bot why i didnt focus sup i just ingite him cause i was lost and she was the only low life dat lag... just why did u do that u saw them with wards get life pls garne noob mf u just go suicide  alone when we no wards get banshee to counter talon AND yi if 3 of us get banshee they los this mf get banshee PLS all dat focus omg thas why banshee is good sotp trowing mf this mf srsly... sure died 15 insults other of stupid we can win u know i just stop die mean u bu me too.. they all ad get armor DUD I DID cause we no choice late game r u very retard mf or u just drunk? y go def sRLY? 0.1 sec for baron bad luck y pls;43;43;10036
43;Talon;enemy;10;00:01:07;00:47:58;0;INVADEï¿½ï¿½ï¿½ï¿½ ss twis you are adc def def twit ui report you ward baron all mid ples back def #NAME?;43;43;10036
43;Twitch;enemy;12;00:01:13;00:35:08;0;no k i go jungle yi u are adc u take kills and farm so u are adc yi go to bot and farm and stop roaming no yi is he take farm and kills i cant go 1v4 lol im the only 1 who is lvl 18 and im jungle well not anymore i kill miss fortune;43;43;10036
43;Wukong;enemy;35;00:00:26;00:47:12;1;come on twitch.... why troll... evry time 1 champion troll in my team... twitch don't have damage maestries :/ talon why ks garen cunter me if u don't let me kill they open my ass ss re gg ye garen u cunter me master y omg go top i need help they cunter me ... go under tower twitch? this troller ...:( op uff twitch we need u lol gg mastery? lucky omg lol twitch never help on team fight leona afk? twitch!!!!!! if u don't help on teamfight we can play cant^t ye y play last game whit it and troll too we need help on team fight twitch fuc k barom? ye lol;43;43;10036
44;Annie;ally;7;00:00:17;00:33:11;0;yeahï¿½come cait gets red after lvl 4 duo mid let me free farm please ill get rabadons im getting damage :D Thresh threw the game;44;44;10037
44;Ashe;enemy;19;00:11:02;00:32:09;0;let me the kill lol l2p gg push top hard now 3 ... np i push bot my farm really? xDDDDDDDDDDDDD baron dio+Ì¤ they diont have tanks and we have 2 so close;44;44;10037
44;Caitlyn;ally;4;00:00:10;00:32:46;0;doble mid hell yea wtf pls report trsh negative attitude;44;44;10037
44;Fiora;ally;14;00:00:38;00:33:14;0;its a gameeeeeeeeeeeeeeeeeeeeeeeeeeeeeeeee chill who cares there will be no red xD come at me broo lololol clicked on bush hahah care oh god nobody of you has some dmg :d god xD they jokin me bg finish report lucky irelia;44;44;10037
44;Irelia;enemy;12;00:04:25;00:30:51;1;wauw! the facuk Dafuq ur dmg fiora i do wolves udyr go top and hold it u cant fight her alone wake up i got it ty nope wait holy fuk;44;44;10037
44;Jinx;ally;7;00:00:08;00:33:19;1;gj no jungle me2 buddy thresh ur forcing me into this - why let me poke in peace and care for my escape lantern not oger in and force me to act on ur why would u w8 for me who da fick engages this l2p plz oh caty or caty troll;44;44;10037
44;Morgana;enemy;41;00:00:28;00:32:40;1;they dont have jungler invade their red? 2 top i think 2 mids udyr wake up see mid wake up ty gj need b cover or bb mid oh i cant blue? playing vs 2? .. ss mid 2 ss annie and cait ss annie ss y? i must hold mid ashe wtf no help? ty ashe and we lose 2 turret noob gj was under turret .. ward let me some farm need zonya gj we r doing well guys :) but need finish fast cause they have 2 adcs why 2 mid?;44;44;10037
44;Sona;enemy;19;00:01:32;00:33:05;0;ashe jinx nno flash indeed... I flash ult sry ashe... come on after that after you got turret k let's calm down stop getting caught out red buff sona op ashe you don't need farm more than morgana udyr pay less attention lagged... irelia buy thornmail udyr too ASHE;44;44;10037
44;Thresh;offender;18;00:00:33;00:33:01;0;blue for annie caith top ? go red witch diore fiora yes im angry no jungler blue jinx just surrend pls i go eat is over pls surrender is finish is over osef ok no ward look my lvl x) finish pls troll premade yes troll premade report you;44;44;10037
44;Udyr;enemy;19;00:00:36;00:33:12;0;i will smite and gank top they havent JUNGLER dat dmg gj fk dat ulti morg ashe? omg .. all mid dat dmg .. we are loosing this game.. warded run b im dmg GG WP;44;44;10037
45;Ahri;ally;26;00:01:23;00:27:34;1;sry was on toilette xD OMG OMG I PINGED BACK!!! ty ^^ i was eating, but now i finished xD hes back me blue pls ty Dont fuuck with me! ty yasou xD mad? nice feed bot noobs report yasou, and bot lane pls report them pls, jinx OMG team? place ur totems pls! that noob j4 why go solo vs 2? sure he is yes but u already die jhust let play as team all mid we can win gj gg;45;45;10038
45;Dr. Mundo;enemy;5;00:04:26;00:27:54;0;Dat shield U had luck because u had the shield when u came for auto attack me x') wtf worst lagg ever gg;45;45;10038
45;Jarvan IV;ally;18;00:06:58;00:25:01;1;i did so many fails XD damb chill, didnt know he still had his ult didnt i just help you 2? yes, they are noobs, thats why i helped he got flanked you need to ping ahrie ikr nd this bot this is why i hate premades i fucked up fuck our bot lane for feeding :D why wont you surrend? but this bot tho jinx that would be great it was not a solo it was a duo till zyra died fak mundo;45;45;10038
45;Jinx;enemy;12;00:04:06;00:24:01;1;gj uh ty u2 tt true O.O nooo fking jarv u need jarv to kill me noobs yes ahri ur boobs :Q____ thx botlane 4 fed me DEMACIAAAAA;45;45;10038
45;Jinx;offender;11;00:00:20;00:21:17;0;se vuoi l adc no il support bot feed and bot  0 help report yasuno for flame pls pro yasuno yasuno i go afk and play in 4? 3 bot 3 bot stop flame or i go afk ^^ ok bye;45;45;10038
45;Sona;enemy;22;00:02:26;00:27:34;1;nice flash sorry ^^ ult up gj lol botlane are noobs cause we're not playing well at all and look at our score ult up sorry noooooo yeas, run, puny botlane, run! sorry did you mean honor enemy botlane? :D that was a bit late, guys xD thanks for no help at all I ultid them you should've killed em all ah ok ^^ np lich bane sona op gg wp;45;45;10038
45;Talon;enemy;21;00:04:06;00:27:36;1;gjh same for mid, she's too greedy w00t well played re gj push hard mundo calm yo tits happy gj doublr good job now push hard fucking loads of you to kill me XD tbf, top and mid have played well too gj didnt mean to leave you die at mid dmg spike now though xD dmg spike XD gj wp;45;45;10038
45;Yasuo;ally;38;00:01:44;00:27:43;1;from? gj yep :D yep :D but its not luck its skill ^^ pls guys ty^ sry j4 pfff omg botlane feed ^^ to late ahri pls report our botlane :D ss ahah i cant do anything you are to fed ^^ gj yep but elise is to feed because of you jinx ^^ fu fail sry my faukt np ss ahri sry i hate mundo.. that hit box!!!!!! not funny ^^ ahah XD second one :D ahah for what we def man j4 is not noob ahah i could kill her :D gj just to lucky wtf!!!! i did ignite why you focus mundo?? :D MINIONS GUYS wow :) gg wp;45;45;10038
45;Zyra;ally;5;00:01:12;00:27:47;0;manco ce l'ho.... ok 'camiseria you are welcome mundo immortale;45;45;10038
46;Annie;ally;2;00:20:52;00:28:50;0;ok gg;46;46;10039
46;Ezreal;enemy;3;00:00:35;00:28:44;0;gl hf WTF gg wp;46;46;10039
46;Nasus;enemy;4;00:01:37;00:28:41;1;fcking tiger rengar got carried need 4 for me? BG;46;46;10039
46;Nocturne;ally;1;00:28:47;00:28:47;0;gg;46;46;10039
46;Quinn;ally;1;00:28:50;00:28:50;0;gg;46;46;10039
46;Rengar;offender;4;00:01:49;00:28:49;0;Grrrr y 4 4 3 op gg easy;46;46;10039
46;Swain;enemy;1;00:14:51;00:14:51;0;CHAT;46;46;10039
47;Ashe;ally;118;00:01:42;00:36:10;1;omfg diana go mid after blue dont take farm pelase kha when im bot omg cya tower nice teemo kha why u wait so long to gank thanks for the help kha u cuold have helped me earlier thanks! you could saved me before ............. u dont know how to play in team why not take the lantern diana? 0 ganks gg kayle 7 kills....... fck men how many do i need to ping?? omfg gg wp ty for no help omfg thanks team omfg thanks kha lol if i had to run iw ould have died to so dw listen to team pelase kayle is fed emen fck dont take farm diana omfg OMFG THIS TEAM MEN LISTEN TO FCKING PINGS split more ffs what a team jezus crist l2p please KHA WTF UR DOING LOOK UR LANE omfg khazix wtf ur doing ur the noob losing ur lane so ahrd look ur lane and then talking about me? KHA WATCH TOWERS POUSH MID NOW KHA PUSH THEN OMFG ur losing the game fcking noob look how they push and you prefer to farm above push omfg lol i got killed cuz u didnt ssed or jhelped so dont talk please GO BACK FFS what a noobs jezus diana did 0 push more shrooms teemo push something men feed vayne to kha omfg teemo wtf report team please kha l2p please WHY GO ON SINGED KHA WTF focus her ffs this team teemo diana shit kha shit omfg this team 0 help DEFEND BASE DIANA BACK OMFG lol kha im the feeder? for? lmao?XD this kha is saying im noob because he is playing solo and not in a team we need team play diana game is lost already cuz of u so u playing solo so no u focus singed let me farm ffs omfg i need money _____ omg that feeded kayle l2p guys please fcous kayle not easy kills nice chase teemo and kha noobs u guys so bad seriouslly this team playing for kills not for win so bad omg let them push its over teemo blame kha khas fault playing solo and for kills omfg nobody defendS? please l2p kha you only go for kills while u could have pushed pelase l2p naab lmao minions op lol kha is solo so i go solo to more minions 53% minions please l2p khazix gg khazix nooob kha;47;47;1004
47;Diana;ally;2;00:29:56;00:30:34;0;we need wards in baron all mid;47;47;1004
47;Kayle;enemy;11;00:01:32;00:20:20;1;guys i have worst day ever i lost every1 game today and now from promotion i have 0 points ss mid guys great start again i dont have any1 to gank mid and they gank me dont push ffs noob great team i dont know who is worse hahaha singed omfg;47;47;1004
47;Kha'Zix;offender;35;00:06:52;00:32:55;1;need next blue pls u too shut upa she i m khazix u dotn know kha? noob no suyre lol look at ur score and just shut up pls noob ashe xDD ataking while kayle ult what a noob that botlane i need teemo need more shut up with u report shut up noob ur so abd ashe shut up and pla look ur socre and shut up SHUT UP ASHE NOOB shut up feeder report ashe flaming stop talking ashe noob omg can u stop talking big noob ever? shut up feeder report ashe sure that ulti game is win sure not cause of u bastard lol? shut up pls ur ridiculous reprot ashe thresh omg;47;47;1004
47;Nidalee;enemy;10;00:02:01;00:33:05;0;maybe its not his fault -.- tought of that? teemo doesnt counter singed dont get lame excuses i dont understand how u cant play vs teemo with singed uau qye pro srry vayne come mid who is laughinh now tresh? not my problem;47;47;1004
47;Singed;enemy;12;00:06:34;00:36:09;0;damn sry ok xD damn is my counter :/ help me top pls anybody gj i canï¿½t vs teemo i need to kill... gg;47;47;1004
47;Teemo;ally;25;00:01:26;00:36:09;1;kha ? gj i told you i'm not bad :) nice omf diana don't feed kayle pls stop you're throwing me too fck you i will report you noob lol singed so funny brianed diana stop feeding pls let you guys are rly bad nice arrow kha !!!!! focus kayle!!! idiot fck you noobs stop solo report my team pls noobs;47;47;1004
47;Thresh;ally;9;00:19:22;00:35:52;1;gg team kha reported WHO FED KAYLE!?!!?!?! wtf diana report team axept ashe not my fault this team ahahhahhaa GG KHA;47;47;1004
47;Vayne;enemy;12;00:01:13;00:35:02;0;dafaq ww same i lost series twice cos of afkers ward pls pls nida next b go base kha missing can i farm that lol this teeemo he just dont give a phuck flame? looooooooooooooooool;47;47;1004
47;Warwick;enemy;28;00:05:58;00:36:05;1;sorry pc crashed i am really sorry do not talk respectless omw to top i will ult pls throw him  ok? singed ok? k #NAME? i am so retarted did not had ult gg i am pressing r like a faggot nothing happens sorry dude b why? why do not b dat dmg ... sorry this time i will rly ult gj kayler kk just surrend lol they follow you just surrend gg wp;47;47;1004
48;Caitlyn;ally;12;00:10:05;00:24:06;0;again nice ulti ez next time let artican jarvan gj supp afk just surrender support afk 1 v2 interessing i'm 1v2 no help it's ok lol they are feed o it's funny 1/5 SO FUNNY why jarvan? click yeesss rreport tresh;48;48;10040
48;Ezreal;enemy;7;00:08:31;00:24:06;0;that ult XD free kill i got ur back XD just wanted to save talon XD XD wp;48;48;10040
48;Fiddlesticks;enemy;9;00:06:36;00:13:26;1;clear ior not fu sry brb clear gj worth it damn it miss click;48;48;10040
48;Jarvan IV;ally;28;00:01:17;00:24:03;1;ye fu ckk soz didnt realize the turret hit me kata need gank? ty ye lol? why u didnt back? lol my timing ulted ? ye cait i won a lot of 2v1 bot lane and katarina have right its not ranked u fed ezreal not me so stfu i will only report cait yes? i wanaa play a normal game wp;48;48;10040
48;Katarina;offender;42;00:02:33;00:23:59;1;no igntae of flash mid baited yes YOU STILL BAITED not in the first min i have ignite no lol i didint preess ult wellwellwell why talon no u cant do so i givw you a tip fail j4 ? wtf you didint see he ulted? ok rengar feed u do so much damage and are so feed yeah but not jungle lee hwy the hell u do ult and not q do u did ult and didint press q ohhh dear wp so much damage bot have rly feed u mmm lol did i not b lee chill you this is 1 game of how many so chill dont flame have fun lee stfu report lee for flame all the time ok lee mted report lee plz guys? berbal abuse verbal abuse gg;48;48;10040
48;Lee Sin;ally;22;00:01:10;00:24:07;1;"you start red? ? .. :/ WTF I do But, 0.5 sec late :/. BECAUSE I CAN'T You don't understand? My Q have ntot ilimity time ss top Thx J4 and Tresh for ruined the game :) Jarvan shut up bastard noob Don't replay J4 in your life Kata, you are so bad ok for? Said you I insults cause ""stfu Lee"" I'm not your dog, I didn't flame you gg wp report J4 + tesh";48;48;10040
48;Rengar;enemy;17;00:02:01;00:24:05;0;hard pls warded ? no ^^ gj :D rengar op jungle is the best role to carry game kk top warded ? fuck dat snipe i ulted :'( y gj i waste my ult ^^ i can solo coming top gj need 3 more stack on my necklace :p GG;48;48;10040
48;Talon;enemy;6;00:03:50;00:16:06;0;no i have been stupid to go under tturrets u are lucky this time i njeed help i do it i have life stael;48;48;10040
48;Thresh;ally;2;00:00:57;00:04:15;0;lol :d;48;48;10040
48;Vi;enemy;8;00:04:04;00:24:04;0;miss click gj , ? ^^ euuuuuuuuuu maybe gg wp;48;48;10040
49;Annie;ally;18;00:06:54;00:33:46;0;nice ward 5 bot wow ward i miss the tiber im lucky so omg no damage from riven first time i see it why troll? dont understand still dont understand why kassa need to be kid for another kid. isnt over;49;49;10041
49;Jarvan IV;enemy;66;00:01:35;00:36:36;1;ill smite ofc ty gj kassa midd miss k :/ ARE U SERIOUS?! U WAITED FOR LIKE 10 SECONDS i was almost dead when u came ffs -.- u have silence fck u no blue for u gj i failed everything xD xD GJ THE PLAYS gj xD gj blue np ME AND LEE CAN CARRY THIS HARD :D yeah we pretty muched fcked them up me and u srsly just kill tristana they have no damage other than tris y tht too xD JINX PLAY SAFE UD OTN HAVE ANY ESCAPE jinx NEEDS to stay behind team and use long raneg cannon dont dive me? i left instantly well... gj brb leblanc try to burst tris WTF ARE U DOING JUST FOCUS TRISTANA SIMPLE AS THAt I JUMPED AFTER HER AND ULTER HER THEN I WAS ALONE WTF NO HELP BARON NOW KILL TRIS AND WIN me2 lee won that because he caught kassa out of position umm now just use baron and fight lee gg;49;49;10041
49;Jinx;enemy;6;00:02:06;00:36:36;0;np gj leo i'm rly bad adc ^^ lol, nope i don't like u gg,wp.;49;49;10041
49;Kassadin;ally;19;00:08:56;00:34:09;1;why not u dont need blue stupid haha that noob vi yes ofc i did cuz he couldnt basic u when he was rigth next to u and i had no mana for ult cuz no blue thougth ur clone didnt show items but apparetnly it did u blind? st start to look map accept ur fault i did with ping well mute on u all retards haha :) 'i can solo baron guys damn it so close they called me noob= i act like a noob their punishment :) well if they gona act like spoiled kids that got no manners im gona teach them to not be aroogant bastards (my logic) still muted vi so cant hear u;49;49;10041
49;LeBlanc;enemy;32;00:08:21;00:36:37;1;fuck FOR HIM TO BURN ULT ITS OBVIOUS HE WAS TOO FAR FU CKIN MORON : ) well, you died as well ty gj lee, ffs shut up ypu left us for what ? WHY? FOR RIVEN? YOU DIDNT EVEN KILLED HER YOU WASTED TIME you did nothing, sir you just fu ck that tf : / youre iutplayed me youre right. outplayed  * pink it first : | i cant do shit. yup. youre brave, smart and funny adult - sama. yeah, lee a fu ckin carry stop complaining stop complaining. one man that failed lane cant throe thorow.;49;49;10041
49;Lee Sin;enemy;32;00:05:22;00:36:35;1;riven no flash faaaaaaaak 2 wavews :( riven SS nah only all 5 can do it :) guys plz dont 3v5 engage only cuz we super little ahead just dont start 3v5 plz again ? srsly stop it left? i was top split push wtf muted u dove ok i go back split push we suck at teamfights #NAME? this is retarded i dont join tf anymore i did but she jumped and jukes us got randiuns maybe dont flame him next time ? gg;49;49;10041
49;Leona;enemy;4;00:04:33;00:36:36;0;u2 :) YES :) ggwp;49;49;10041
49;Tristana;ally;9;00:06:51;00:32:54;0;gg OMFG and no kassa coming ... u came when we were all dead accept ur fault and do it better next time... i need red please ty ggwp;49;49;10041
49;Vi;offender;61;00:06:46;00:36:14;1;"back pls u2 say ss pls next blue not tis this * i have to gank all lanes no ulti wow wp minions blocked me xD deward pls again no ss say ss ur job too u didn't even ping the truth hurt no u touched this riven give damage to rvien 01.Aug let's blue kassa go focus team y take it drake go defen fuck really ? wp kassa pls thx for this kassa xD free nashor btw because this kassa died i didn't call u noob stop it pls NIKTAMEERE KASSA say thx to kassa for this throw GET CANCER ASSHOLE only guy like that i didn't flame but now it's over he onlt do it because i said "" really "" better like that say to him my apologises z* tell him stop troll gg wp this kassa destroyed this game how i didn't flame";49;49;10041
50;Diana;enemy;13;00:03:53;00:27:12;0;Mord' my counter.. Yes but you are my counter.. GG back Fiora SS MLID WTF WHY Haha ^^ Olaf no problem for KS just kill him I dont cri for KS Haha no problem but thanks you for try too let me the kill gg Olaf Sona don't forget you are a supp gg;50;50;10042
50;Draven;enemy;9;00:02:01;00:22:12;0;low fps at start play def pls no mana gj ks i know xD sorry xD i'm sorry not you xD goddamn lag! sorry and my lag a feed support xD;50;50;10042
50;Garen;ally;8;00:17:32;00:26:37;0;thanks no we can win omg jinx no help?. come on we can win am i the only good player here?? need to win plz;50;50;10042
50;Hecarim;ally;12;00:02:06;00:26:41;0;thx thx for help garen... top is so bad SERIOUSLY JINX!? U did nothing And u didn't kill draven! no mana.. Soraka I need mana plz thx I TRIED I am not good but I try to help and yes jinx is noob no mord;50;50;10042
50;Jinx;offender;25;00:01:15;00:26:36;1;..........soraka i said first adc wtf why you cray? ...... stop farm report soraka plz yes lol ? ............... first time wish jinx...lol ????? wtf you die i help you ......fuckk you nice sorraka gj soraka noob no never soraka noob gj i help you garen i help you no ulti... report soraka for feed yes yes or no?;50;50;10042
50;Mordekaiser;ally;5;00:05:33;00:26:38;1;lucky diana nice ss ya not now pls garen shutr up;50;50;10042
50;Olaf;enemy;21;00:02:04;00:27:11;0;ty diana i ping omg!!! gj i not want ks ok but srry ok np play again after? --- ty gj yes srry draven i give kil now ty gj go jungle all you too draven adc need red ok srry gg;50;50;10042
50;Sona;enemy;10;00:08:02;00:27:11;0;me too u too xD no mana xD my bad :/ i dont forget i dont wanna do ks, but sometimes... with the basic attack i kill i cant do nothing, sorry diana gg;50;50;10042
