id;champion_name;association_to_offender;message_count;first_time;last_time;label;message;first_id;last_id;chatlog_id
72;Yasuo;enemy;42;00:01:34;00:47:28;1;gege j4 mid every time mirrior lane -.- wtf gtfo srsly 3rd gank mid get aids ofmg get aids asap please die a painful death wat yas gegwp surr 20 fuck this ame l2p can't do shit without j4 open your fucking eyes nub gtfo midlane wauw u so bad QQ kill secure heal? -.- oimffgggggg yoiu suck harder then kim kardashian srsly ty for sucking D On ur face? getting GA GO TRYNDA :D QQ GEGEGMOFOS :p;72;72;101
73;Ezreal;enemy;2;00:15:24;00:16:44;0;wow :D;73;73;1010
73;Gragas;ally;14;00:01:34;00:43:00;0;k this lag fuk me my ulti :( its the beer i fuk my ulti again we was at -10kill dif and now 0 1 drak iche but we need 2 tower push top plz nice focus on me... 25 sec 15 gg;73;73;1010
73;Jinx;ally;3;00:28:05;00:40:00;0;Nice save on Ez Gragas brb wait;73;73;1010
73;Katarina;offender;60;00:01:18;00:42:51;1;gragas if renekton mid we switch ok? fuck sry wp jinix ehh lux*ï¿½ï¿½ i know sorry - hi olaf gj sorry lux dude you was better at start lux got rabba olaf is so fat jinix omg OMGGGG renekton and olaf are fat its over xD XD #fat renekton 4v1 we needed so long Sad fight? becouse they are all time 2 and we 5 cant belive that OMG THEY ARE FAT lux was nice on mid nope renekton SOOOOO FAST GUYS focus ez hahahha dont be greedy now no jinix protect jinix pls waerd back gragas try ulti on ez w8 team lets push mid thx guys we got baron buff so fight now COme all mid w8 no solo end it gg wp;73;73;1010
73;Lee Sin;ally;16;00:02:01;00:42:58;0;ty hi warded kata want blue woops jinx red atleast we win fights and push turrets i know renek is top thats how the throw ke i will report her lol come back ah gg wp;73;73;1010
73;Leona;enemy;27;00:23:55;00:43:05;1;ez's farm tower and back sry lux i have freeze on my screen omg SHUT UP I HELP HIM y pls ty<3 lux ? np you ruin omg no on this fight is you why go top ? COME MID PLD pls lux cmon do it for the win bronze sirit.. pathetic y lol lux fail his lane ans she flame y gg;73;73;1010
73;Lux;enemy;51;00:05:35;00:42:59;1;klet her jump lol hi that lucker lucky was in cd olaf kidding me ? stop taking my farm you push omg this is gank olaf not yours no mana olaf are yo ufucking noob ? kata omg kill her omg that team omg i marked like --- times they gank me al lthe time olaf made 0 good ganks just pushing my lane i won`t you sucks ty bot olaf kil l more minion and i leave why all atack me all the time babysitting me pfff i told you olaf bye you push all the time noob i lost like 30 farm becasue of you you can see why i stay afk look olaf all the time farming my midle leona rly ? defend me noob so i can atack are yo ustupid ? you run before me so they kill me easy n1 i don`t fuckign care learn how to play i say him waht to do i don`t flame leona save him omg that leona next time come more so i can make fun olaf gganks were great i`m bad and they must report me when you sucks i say what i think learn to play renekton there are other lanes too for solo player it`s not you want to report me and expect me to come lol i don`t care you wil lreport me anyway you say noob i report you now cry so i play no wy omg way yes they have adc noobs haha so bad team lol i fail ? hahahahahahahahahah;73;73;1010
73;Olaf;enemy;26;00:02:04;00:43:05;1;ty n1 gg stop cry dat luck omfg PUSH NOOB omfg this lux is noob report lux pls WTF report lux! lux x9 she flamer kid toghter guys LUX omfg u want lose? x9 lux pls pls focus jinx and lata kata yes lux ruined the game lux stop kid this is rank lux u are a kid bg report lux all pls noob lux;73;73;1010
73;Renekton;enemy;34;00:03:26;00:42:45;0;gj gragas goes warmogs too tanky lee top lux relax we are winning anyway please no flames lux you arent even in the lane ^^ that ult and my team still doesnt push anything else i should have just stayed and fought i wouldve gotten one yes fight ^^ oh god lux please stop flame or i leave dont dive so deep please olaf yes lux so toxic report please i def top then we should group mid as 5 heal then group not when they are all alive group 5 people mid come mid kata first and stun her while ult at least steal because the other lanes were pushing for us anyway now deff until baron wears off and then please all on one lane dont fight without tower if they have baron care ... gg well whoever initiated this lost the last fight;73;73;1010
74;Darius;enemy;9;00:28:45;00:42:51;0;go away !!!! ! retaric jinx why boots of swiftness? useledd ok shaco reported and report for iu feeding me;74;74;1011
74;Fizz;enemy;2;00:13:52;00:16:53;0;no ss no ss bot?;74;74;1011
74;Jarvan IV;ally;37;00:01:27;00:44:32;1;a wonder a jinx in a game omfg rly yours not too --- blue u *o rly shaco try stay safer pls ... sry guys but i cant do more then help u gj thx gj thuis stun no chance to flash thank you for heloing me i safe ur ass and u run .. OMFG RLY ARE U SHIT KIDDING ME MY FUCKIN TEAM I CANT BELIEVE IT THIS FOLLOWING 2ND TIME WOW wow gg wp -.- nasus pls too if u follow we can easily win idiot i was high fed.. -.- bg wp report nasus and shaco pls;74;74;1011
74;Jinx;enemy;2;00:31:16;00:31:43;0;for more speed i don't think so;74;74;1011
74;Nasus;offender;8;00:28:29;00:43:26;1;nunu hp? 29 hp :P NARWAHHHHHLS JARVAN YOU ARE NOT SO GOOD YOUR SELF NO PENTA? report darius for not getting penta report darius for not getting penta noob;74;74;1011
74;Nunu;enemy;3;00:00:24;00:28:35;0;smiteless pls its not your blue bro 10 or so;74;74;1011
74;Shaco;ally;5;00:26:40;00:43:04;0;yes no penta for u darius for what? :) u are funny i like u;74;74;1011
75;Blitzcrank;enemy;10;00:01:13;01:02:15;0;Invade? jinx ... gj zed lag chill stick together no mana gg;75;75;1012
75;Blitzcrank;offender;47;00:03:36;01:02:31;1;JUUUUUUHUUUUUUU noo nooob gj stop feed zed shyvanna NO! nice feed ty noob jinx report nice feed pls get a bann gg we lost report shyvanna and volibear! only feed nice feed ty we lost surrender pls i died 1 time idiot shyvanna go top i am support nice ss btw you arent op learn q you arent good you are only fed shyvanna! and shyvanna and vloi feed you FAGGOT stop feed pls go afk shy nice ss say ss noob go jungle jinx dont push pls sry defend pls NOOOB! report yourself no feeder np easy omg ks noob :D yes ty blitzi no go mid FAGGOTS PUSH gg noob team noob shyvanna help us DONT FOCUS THE TANKS GG REPORT SHYVANNA AND GG;75;75;1012
75;Jinx;ally;2;00:50:55;01:00:59;0;LETS PUUUUUSH push mid;75;75;1012
75;Jinx;enemy;6;00:11:17;00:42:20;0;gg duck sry yooz ? xD;75;75;1012
75;Malphite;enemy;72;00:01:15;01:02:32;1;no blitz stay there, we get voli after kk go gj jungler bewgind you bot :/ dont do that to me blitzx focus jinx gj fail sorry nagh kill is a kill push your lanes now gj focusing all the wrong people OMFG ATTACK i got all fucking 4. and you dont attack stop going in jeez solo pro fucking idiot stay at the tower STAY AT THE TOWER 3v5 usless, 5v5 chance i still need blue buff pull vei stay behind minions ffs report you for taking my blue upjinx troll face :D shyvannnaaaaa fucking focus gg shyvana defend one at least ok gogo english? speak it then FOCUS SHYVANA AND JINX you can do this its simple i took jinx solo 3v1 so focus shyvana mainly veigar is noob. take 40+ resist GANK late back off back off a bit BACK OFF bbbb you keep holding them at the tower. we need to ace. you cant do that under the tower top gogogo gj nice grab finally son of a bitch isolated. kill her kill the isolated ones gg overextended go mid unbelieveable all you had to do was run barons up go ward it theyre going baron GG nice tower 2 25% SHYVANA SHYVANA you guys. gg wp;75;75;1012
75;Shyvana;ally;10;00:09:23;00:53:59;1;stfu ok go, top blitz go  top and do it better stop feedimng blitz no you go top now and make it better than us stfu stfu so better? gg gj;75;75;1012
75;Veigar;ally;2;00:13:02;00:13:50;0;TO OP SHYVANNA;75;75;1012
75;Veigar;enemy;3;00:31:22;00:54:35;0;sorry bout du grap -- push mid* PUSH MALPHITE ON TEMPO;75;75;1012
75;Volibear;ally;18;00:07:14;01:02:33;1;chill fail stfu report this blitz only flaming stop feeding blitz run veigar blitz camper :D gj jinx stop ks gj jnix jinx come back pro gg and report blitz;75;75;1012
75;Zed;enemy;27;00:09:32;01:01:45;1;ahhahahahaha hahaha im op loook jiinx noob look my jiinx yes but i do 8.1 lucky omg maph ks omg noob team noob report malph pls i don't tlking blitz take you blue stupid ahahah thx my bot lane noob fand feeding tyes u have a preblem? i love my teamwork noob malph omg omg fk u solo don't kill me voli we lose noob voli haahah no u don't do 1 vs 1 becose u are noob;75;75;1012
76;Gragas;enemy;8;00:19:09;00:25:35;0;shen and irelia dont protect jsut run ... lux is focus by lee and rengar :) op minnion btw its not only janna fault gg wp;76;76;1013
76;Lee Sin;ally;7;00:03:13;00:17:40;1;janna afk :( why ap trit hell i jsut asked dumbass tooo mlate;76;76;1013
76;Soraka;ally;3;00:02:32;00:25:39;0;sry just kill kass wp;76;76;1013
76;Tristana;offender;13;00:02:06;00:24:39;0;12 hp. really. :/ Report janna. mana ? :) o shit reported. This bug. trist shouldn't be caught mid air. Y sure blame it on me 4 v 5 , go ahead blame me. need to sell all and go ad . . ? report janna, wp 4 v 5 first 12 minutes. Go do the math kid.;76;76;1013
77;Brand;enemy;2;00:15:22;00:38:52;0;hacks gg;77;77;1014
77;Evelynn;ally;54;00:01:41;00:38:43;1;youre mad jinx x) ty just want my Z gg yasuo ^^ stop spag gyts i just want 30 gols --' Come more fast viktor im not a tank EVE WHAT? YOU THINK I CAN TP?! No sorry im not shen,im not tf i cant np saty under tower She had surprise me, i dont think saw her if nasus ulti back push no Stfu ok? all the team flame me lol The top cauz i dont come the mid cauz i dead incoming tower top lost cauz he dont push ^^ drake? nasus --- cs Its over ahah Omg jinx! Jinx you noob I stop playing You take my red what is this team ahah in early i wad good score bot fall top* nice let nasus farm and destroy game is over inib 1 tow Ide help you yasu stop being the victime youre lost youre top and you will die if im not her drake viktoN nasus --- farï¿½_ Over ... nasus imba surrender nash agains me... pro jinx defedn HE HAD NASH BACK! OMG When i said back you dont back Noob team;77;77;1014
77;Nasus;enemy;9;00:00:21;00:38:53;1;nice one yasuo -.- i said top so i play top tard nope u didnt yea you do nasus support is useless unbelievable rly? -.- cmon rly? gg;77;77;1014
77;Vi;enemy;3;00:00:50;00:38:52;0;ysou called first dude REAL gg;77;77;1014
77;Viktor;ally;7;00:08:33;00:35:06;1;sry eve didnt see u eve .... ty for feeding my brand eve ok brand is silenced and he uses skills hahah was yes ok;77;77;1014
77;Yasuo;enemy;4;00:00:27;00:01:49;0;dude don't get dorans shield on support nasus I called and picked before you at least one should do something intelligent ... it isn't;77;77;1014
77;Yasuo;offender;35;00:01:26;00:38:55;0;yasuo top ^^ eve ! they are two top before ... fuck eve ï¿½ i need help ! i say twice 0 --' ty 4 kill brand you die twice not solo eve ... dat  ! can you go top eve ? fuckk dat luck --' no fuckk dat eve ! i neeed help too hard i can't go top now omg da t! it's you who say that ! too fee d! shut up you don't help i can't stay yes because 7 kill ... wsoow so feed gg wp l report eve for flame;77;77;1014
78;Akali;ally;4;00:07:41;00:25:38;1;still ss mid gj shaco stfu second ks;78;78;1015
78;Annie;enemy;5;00:11:59;00:17:05;0;ss top ? -.- fuckignt top sad ss !!!!!;78;78;1015
78;Ashe;ally;7;00:05:24;00:16:53;0;im sry dc lol fuckin dc i would say ah ok nono i have 31 farm;78;78;1015
78;Nunu;enemy;10;00:02:31;00:19:58;1;dat flas brb buy wards omg digga ved vi no miss all bot top lane retarded;78;78;1015
78;Ryze;enemy;12;00:00:37;00:25:49;1;lol tg says shaco xD that's my nigg a ignore shaco find a gf first what about real life shaco? BIM what about real life shaco? what about real life shaco? ggggggggggg;78;78;1015
78;Shaco;offender;27;00:05:35;00:25:50;1;me too XD vi focus vic XD cut viktor gg vik :D xD that was my buff noob for u? :P soz dnt know that u will jump again u are happy? lol dont have flash noob haha HAHAHAHA VIKTOR y when i see u iï¿½ï¿½ï¿½see a free kill i'm 7/0 so i dnt have life? ur first kill GG hahahaha EASYYYY;78;78;1015
78;Sona;ally;13;00:00:26;00:21:24;1;plz report shaco, instant lock and trolling nice one... shace, ashe afk... ss noob not you shaco for ks brb gj ashe, vi fuck, stupid my fault brb yes, plz..;78;78;1015
78;Vi;ally;9;00:00:36;00:16:38;0;yes pls, report him.... yeah shaco afk oom gj that was my kill.... let me blue pls shaco.... ty ty;78;78;1015
78;Viktor;enemy;19;00:10:23;00:25:52;1;u can say ss :/ shako gank on top su c k e r :) i love u too ahah su cker yep u used ur flash and ulti and u failed twice i like that dont care stfu shaco u like me ? now suc k my dic k no do u have friends ? gg;78;78;1015
79;Caitlyn;enemy;10;00:13:17;00:20:56;0;OMGGGG I THPUGHT THEY DIDNT HNAVE ANY WARD OMFG -.- so annooying wtf i lagged i keep farm bot wtf i lag so hard sometimes gg;79;79;1016
79;Diana;enemy;30;00:00:26;00:20:54;0;what u pref i mid can roam but top no ^^ ^^ n1 bot if u pink and stop push i can perma gank bot ^^ warded for u veigar mate keep calm i told u stop push ^^ i can babysit i told u oh ^^ np go leona go gj cait the tower KK SOZ ^^ gj guys gj damn ^^ yo why u don't remain? ^^ was a free kill ^^ gg;79;79;1016
79;Kennen;ally;3;00:04:41;00:16:38;0;dunno no clearly you are pro;79;79;1016
79;Leona;enemy;20;00:00:41;00:20:53;0;try top first nasus just play safe and farm Q gj luck after wave B sona no flash mf also no she eneds the tower to farm ffs carcait no wards shop? ss no flash sona it was for 1 so thats good 2 for 1 wait me diana sorry u2 gg;79;79;1016
79;Miss Fortune;ally;5;00:15:06;00:20:56;0;veigar ? look your minimap ? vi was fighting against diana and u was afk turret report veigar thx;79;79;1016
79;Nasus;enemy;20;00:00:15;00:20:58;0;so mid or top, ? veigar we'll see the best farmer :D i can top who is the best Q farm fuck need b pfiou close gj k ward ty dianan ur ward saved me ward worth we got drake so it's worth gg;79;79;1016
79;Shaco;enemy;10;00:00:19;00:20:53;0;cover red please no push? k omnw care top gj --- D sorry --- D ggwp;79;79;1016
79;Sona;ally;13;00:00:50;00:20:58;1;sona best farmer shame :( then again leona got the kill :) could use a gank at bot bot really needs that gank I can only pink so often vi its a pink war down here and they are ahead nice ss veigar Dunno maybe cause you got under --- farm after 17 minutes x4 veigar thx click yes pleaes am done with the flaming wp;79;79;1016
79;Veigar;offender;42;00:00:50;00:20:53;1;yeah NICE TAKE 4 LAST HITS ty serious ? ty ok gues i dont get that help what i wish to have nice kennen nice and u vi do better shit at top instead of ganking mid u piss me of i get mad if suckers play bad ult ? no ? ok d why not all in ? cuz u dont like getting kills yes ? why ? only to say ss and u dont fall back ? no thanks and again all of u are noobs i love it why i get queued with u i dont understad such faggots like u belong in bronze why u noobs arent in there team motherfuckers hehe go away noob u dont even know what this means vi shut up;79;79;1016
79;Vi;ally;22;00:00:33;00:20:57;1;cover my red pls nasus used ghost? waht he didnt die dive? wtf was that ult when shaco ulted thats bullshit should have just dived him stfu dude holy shit sick of listening to you dont play rank if you got a bad mood you are pissed cuz you been losing now shut it pink pls i cant gank they got all warded PINK bot pls kk LOL all you did was flame since champion select kewl story brah lmfao cool story;79;79;1016
80;Ahri;enemy;2;00:19:38;00:22:48;0;xin??? why??;80;80;1017
80;Fizz;offender;58;00:00:57;00:38:32;1;i can't help nida can you stop? pff ups xd omg nasus feeder omg vi noob nasus noob enter let me the kill no omg omg vi retarded help me look noob report vi pls and kyle jaja noobs jaja me vi nasus go top go to your line omg yes ty kyle we lost fast vbatle it nasusssssssssssssss report nasus pls gogogo nasus enter go an that is how to feed a xin vs a nasus i' angry with you vi so shut up nasus full armor no damage full armor nasus come all mid omg defend kyle nasus stay in team feeded if we kill xin zao we win but pls team go in team mid vi push all no enter nasusu report that nasus defend report kyle;80;80;1017
80;Kayle;ally;11;00:02:14;00:38:33;1;np cait afk? report cait plz stfu fizz report fizz plz nasus feeder i am dead i froze even in team they can defaet us yes report fie and cait i lag sry;80;80;1017
80;Lee Sin;enemy;1;00:39:03;00:39:03;0;Gg;80;80;1017
80;Miss Fortune;enemy;2;00:16:48;00:16:59;0;bad jey xD key*;80;80;1017
80;Nasus;ally;2;00:14:40;00:22:36;0;fizz help?? look at mana;80;80;1017
80;Nidalee;enemy;1;00:01:44;00:01:44;0;No ?;80;80;1017
80;Vi;ally;25;00:00:52;00:38:59;1;blue please smiteless ty shit sorry wheres ahri? omg gj we can win with 4 what? are you mad? lol and everybody we can do this gj we can win you see? gj nasus please join teamfight we have to stand together fizz stop flaming or report we can do this wit report fizz for flaming all the time please omg fizz gg wp;80;80;1017
80;Xin Zhao;enemy;11;00:03:35;00:39:03;0;^^ .... ahri? omg miss fortune you kidding? ^^ go away vi!! why? i need 50 hits to kill him, and.... 4 to kill you^^ fuck sry gg;80;80;1017
81;Brand;enemy;1;00:11:38;00:11:38;0;easy for you sliver again unranked :D;81;81;1018
81;Lee Sin;offender;1;00:15:27;00:15:27;0;gg;81;81;1018
81;Vayne;ally;1;00:15:29;00:15:29;0;gg;81;81;1018
81;Wukong;enemy;1;00:11:11;00:11:11;0;pd;81;81;1018
81;Xin Zhao;ally;2;00:11:28;00:15:28;1;Quel mauvÌ© joueur .... noob;81;81;1018
82;Amumu;ally;3;00:15:16;00:32:00;0;gj yi noop trynd hello trynd;82;82;1019
82;Draven;enemy;51;00:00:13;00:37:07;1;gl hf skarner going tanky? gj watch out nami nami don't go so far please that was your fault not minw mine* you're too offensive i had low hp, which should be obv to you, you don't have enough strength or tankiness to attack alone I should have banned amumu.. that ult xd uhm nami? wtf is nami doing? -.- pretty much seriously fck nami report nami please skarner srat stay gotta be kidding me report nami why THE FUCK ME?! I should have banned amumu.. Well neither of you mentioned it so your own fault aswell ... gj really skarner? jerk retard skarner this retard steal my farm which he doesn't need to and it's pretty much kass and gang that does it js that carry huh skarner? fcking idiot skarner you're a god damn retard why are you stealing kills from the adc? are you fuccking dumb? don't play ranked if you don't know your role. gj nami nami ward baron soon gj kass ward gj you don't do much damage.. gg wp;82;82;1019
82;Gangplank;enemy;14;00:00:56;00:34:39;0;ofc re that mumu nice shots :D thx :) GJ! shit 4 enemies come skarner lets kill them ehhh oO lol thornmail on :));82;82;1019
82;Kassadin;enemy;4;00:11:08;00:32:36;1;afk she will retorn cant stay yep nazi;82;82;1019
82;Lux;ally;40;00:00:49;00:37:15;1;ill supp but ur retarde not to respect pick order at least destroy ur lane pls lol worst ward ever dude why u got first blood ?? u shoulda just keep farming not kill np lets go sry yes gj ward well my ultiiiiiiii that laag and yeak no ss ^^ oom omg really guys whats the point concentrate pls lol i full bursted kassadin nobody even kill him omg nice feed gp report thoses premade last pick trolling and feeding the game thx need push ?? yeah report what was that u took likeno damage o0 trynda or yi need to split push i thinkl guys i dont understand u really we 5v3 u dont go ??? we need push or baron twitch real dude u go back didnt even try to carry it was easy kills sure just defend we had to go to nash anyway play with ur head pls omggggggggggggggggggggg omggggggggggggggggg omgggggggggggggggggg noibody helps even in zohnyas i report the retarded and trollin g team gg report premade feeder thx;82;82;1019
82;Master Yi;offender;22;00:00:52;00:32:28;0;we have tp oh come on worth? BT? Bot rk kA gp ulti place war there ward* Tryndamere ^^ they did dragon -.- ? why not back? nice crit come mid wow fight rly he killed gp so stop flaming him;82;82;1019
82;Nami;enemy;7;00:07:14;00:37:14;0;omg draven :/ ï¿½ï¿½ï¿½ï¿½ sorry naci -.- **** gg;82;82;1019
82;Skarner;enemy;10;00:00:53;00:36:58;1;pull off tank omg nami help me yes gg this retard carry ur game okay dmg macchine ok;82;82;1019
82;Tryndamere;ally;10;00:00:29;00:36:18;1;lux sup or mid ? sry focus gangplank then kassa stfu someone pinged to go in twitch u pinged omg no silver dude not bronze i killed gank why amumu ? why ?;82;82;1019
82;Twitch;ally;59;00:00:20;00:37:12;1;damn noobs diaxolux said mid no supp -.- HE SAID MID! -.- u r fkin retard why had take u r retard stop but now we are in the same team so dont feed and play well and dont flame more. ? what? dont lux feeed is good too CALL SS Im talking with Yi ... p.s. don't worry i need 3 more kill and they all defeat Gj :| pls lux leave me those kill amumu sorry but we can engaghe there stop free feed.. 5 vs 4! STYOPPPPp STOP GO ALOOONE stop BAAACK STOOOOOPP ... lux? stupid trynda.. i'll suicide. -.- bronze V sure trynda go back baack skarner! what lux? what? he have too much armor he's fkin feed  by someone... :\ skarner :\ he own me trynda shit u'll report ---% and? handjob top ok sorry but stay with us AMUMU stop go back :\ DEF TRUNDA BACK NOT STAY ALONE ... i said.. ... Yi and Trynda report ---%;82;82;1019
83;Aatrox;ally;36;00:01:08;00:30:14;1;we have low elo? why did you do that? you knew nobody followed ww no flash gj be nice please bot and mid worst gg you guys have high elo? got boosted I guess you guys you* school is good for you doesen't look like it corki you lost it you do 0 dmg and die in a sec is a game yes I'm the only one with good stats and the only one who can play corki suck and your skin refund you do not the champ but u suck balls Aatrox* u know you got a report on your back? flame feed keep on thinking that you'll stay in silver corki bg;83;83;102
83;Ahri;ally;10;00:07:15;00:30:12;0;need blue np care top 0 blues sure all come on serious? team play ok? gg;83;83;102
83;Corki;offender;24;00:01:07;00:30:14;1;comon seriously idiot do u play at bronze?* ï¿½lol? maybe cause im nit feeded its lost idiot team ye sure ahri 1-5 leona 1.6 02.Jun u sukc LEONA U DIED AT START then u failed bot again HAHAHA corki suck??? u must seriously serach help wow atrooz u are so good for what? tell me tell me aatrox nothing will happend anyway bacause of u;83;83;102
83;Darius;enemy;5;00:01:09;00:28:20;0;lol afk leona? :D WW ???????????? no force win...;83;83;102
83;Jinx;enemy;27;00:01:11;00:30:12;1;gj no y no afk gj tresh stop wtf? stop die omg OMG STOP TOP report top and jungler pls look tard u and top ruined my game need kills corki 88cs and me --- lol xD oom care i push bot care dont engage ty no y gg;83;83;102
83;Leona;ally;31;00:00:15;00:29:08;1;fast come fast come omfgÌ¤ wow nothing yre stupod fuking noob thts the way to get fk easily 4 vs 2 seriusly stop failing u have been grab 5 times fuk idiot shut up noob omg i get it ss bort dat team leona nothing are u??? here comes the u guys im 24 licensed so shut up i got 2.6 because of u nppb what a shit of adc lol u kid at least shut up corki and learn to play oh shut up croki;83;83;102
83;Nautilus;ally;25;00:00:33;00:30:01;1;smiteless blue please no wow i have low elo? we said no you still went in omw sry gj i get aegis ? i dont see your name on it leona you are doing so well i am so sprry 'sorry first corki who has not stareted trinity in history of lol silver brcause of you corki cant even build and learn to build flaming thats what they all say bg;83;83;102
83;Thresh;enemy;14;00:01:08;00:28:03;0;gj no flash no ignite and no flash leona corki no flash u 2 thx:) sry^^ hmm idk... dont waste mana sry:D yeah np force baron;83;83;102
83;Warwick;enemy;19;00:01:10;00:30:04;1;gj ty k lol you gave him 2 kills.... I take blue ok take was asking in fact ^^ coming with ulti warded? gj shut the fuck up lol I dont care gj take red no need to force I think ^^ gg;83;83;102
83;Zed;enemy;7;00:05:50;00:30:12;0;farm till 6 ww blue pls ... naut top blue again pls top wards? gg;83;83;102
84;Fiddlesticks;ally;28;00:01:26;00:34:15;1;syndra help me teemo too wtf?! i need this blue teemo stop stop feed he is feeded because teemo is a noob 0/6 wtf?!??!?!? wtf teemo?!???! jill him noob the worst teemo i have ever seen lee is so feed do u know for what teemo? wtf?!??! BOT???? WANT U HELP TEAM !!!! TRISTANA WHAR ARE U DOING IDIOT?! TEEMO HELP ME SYNDRA HELP ME SYNDRA SHUT UP 5/6 TRISTANA!!!!!! HELP MID YES U NOOB U DONR KNOW THAT FIDD NEED BLUE? SYNDRA HELP NOOB SURRENDER;84;84;1020
84;Lee Sin;enemy;16;00:01:30;00:29:21;1;lets not invade.. :) :D gfuys for real -? guys stay focuse.d teemo what you want there? i roam. you fucktard push how yozu can how my team can stay --- and teemo how you fucktard got fed ? OR PUISH MID gj lee . oyu mena yes so overextend;84;84;1020
84;Leona;enemy;47;00:00:46;00:36:54;1;come bot ty invade? oh sorry yes we can he is not afk come let's invade we will win it easy gj all early gank bot WHAT omfg so lucky come on.... i'm sorry sivir don't know what is going on today could we get an gank bot please? we're behind, and i' i'm failing honestly? we're fucked guess so gj mid had to get her so much worth aswell going sunfire first then aegis just b got ult ward gj sorry sivir i activated before you used bounce so bad xin if fed you should babysit -.- re gj xin gj all idd gj you carried whole team but in this fight, all did good n1 that chase -.- gg lee -.- gj gg wp;84;84;1020
84;Sivir;enemy;10;00:00:56;00:29:58;0;Invade? cant we have afk! lee gj np :| !!! why? np :|;84;84;1020
