id;champion_name;association_to_offender;message_count;first_time;last_time;label;message;first_id;last_id;chatlog_id
0;Ezreal;ally;3;00:32:26;00:35:34;0;report for unskilled player is useless thx <3 dat zed so feeded :O;0;0;1
0;Janna;ally;1;00:31:31;00:31:31;0;mimimi;0;0;1
0;Jinx;ally;9;00:25:40;00:59:20;1;im comming for you riven pfft focus Zed always! and stop feed him! Ezreal reported mother fucking noob report Karma for feeding Zed! they got Baron ggwp;0;0;1
0;Jinx;enemy;1;00:59:22;00:59:22;0;GG;0;0;1
0;Karma;ally;6;00:08:53;00:59:26;0;thx top no flash for what ? he has 2 kill in laning phase from me and why you talk about skill you play Udyr guardian + zilian ult to op ^^ gg;0;0;1
0;Riven;enemy;10;00:00:27;00:59:24;0;IIII ISI K udyr top dnt us see it? CAMP MORE PLEASE u want 1v1 ? ok lets continue camping me:)+ lemme --- g Gg;0;0;1
0;Udyr;enemy;9;00:00:21;00:11:48;0;gold 2 zed nice premade lie :o smiteless pls smiteless pls riven? report top no help jnh warded there nice riven you know what a ward is about?;0;0;1
0;Udyr;offender;6;00:14:20;00:59:25;1;bait Karma reported Unskilled No ranked for u my friend Didnt i say unskilled player? gg;0;0;1
0;Zed;enemy;1;00:54:34;00:54:34;0;you should camp;0;0;1
0;Zilean;enemy;6;00:31:55;00:59:26;0;lol jinx i ward abron omg you has my ult .. gg;0;0;1
1;Dr. Mundo;ally;28;00:00:27;00:30:02;1;talon jungle lol gimme blue i invade his red leo ward my blue pls thats why i want you to ward it ouh i mean red FUCK FUCKING FUCK FUCK sorry mate gj lol yea but it took you too long to join us... come on renek ... we actually fucked everything up gj i come bot next haha yea we need to gg wp g j cause i wanted drake? lucian :D na u suck lucain gg wp;1;1;10
1;Jinx;enemy;28;00:01:14;00:26:28;1;w wow much game sense rammus is such a slut cant say no waar box??? ROFL HAHAHAHAHA get fked has no farm doe can u stop with the random taxerino also can i get red? heb sum summoners black guy niet pz so mad black guy no flash again zi ziggs? lol wow als k had geshopt was kill im not fed uGANDA whyd u take red lol;1;1;10
1;Leona;ally;33;00:00:34;00:24:12;0;"strange blue is bot lOL ILL u said ""i start blue"" np bro ill ward ur blue not so fast lucian w8 trresh 1 trinket talon bot talon golem ramuus mid n1 xD sick mmh we were too weak bad idea but nvm ss 2 talon was top ? ok talon bot ^^^' some prob hard focus jinx mmh we should stay on turret I dont give 4 kills not my fault she ult and get 2 free kils then 4 kills not my fault whe cant do more here ! tss just hard focus jinx";1;1;10
1;Lucian;ally;25;00:04:44;00:28:19;1;surekill bot that distance is op wouldnt be different 4 bot ... yy leona you are so bad.you lost this lane gg this leona does nothing.not even to protect adc she can at least you have leona.she's good for you wtf are you doing god llets destroy turrets talon is on me leona carried np honor leona for carrying you why dont uu wait for leona mundo? and that way youlost h this tf? you have been doing that all game.start tf's or chases without the team stop doing that CARE TALON and again you did this all game dude.thats why we loose you screwd thsi sorry now dont blame me when you screw this report lux and mundo for flame pleaseÌ¤;1;1;10
1;Lux;offender;24;00:01:06;00:28:27;1;baron start baron guys timing blue? pro sure hahh LAGGG #NAME? IM LAG how renekton is 0 2 tell me why bb bot lane noob this lucian go play barbie no i blame you qq;1;1;10
1;Rammus;enemy;19;00:01:44;00:29:13;1;ok 0 :D ok :DDD ramuz need killz not frm hax again, mundo wins top PFF need b no pots nvm wow y :D ok, don't focus rene :D certainly not Is that Dutch? run ,you fools what a shit* game;1;1;10
1;Renekton;ally;21;00:03:26;00:29:32;1;cmon dude s1 i saw it last time rammus useless he just kill rest loose nop what.?! no u loose top..^^ ur laning is misarable wp bot.!!! xD lets do some teamplay YO just report them pls they lost alone. wasnt my loose isnt* just a joke lets play since we loose till* the feeders, want to report..xD without jinx rammus had lost it i think..xD;1;1;10
1;Talon;enemy;13;00:01:03;00:29:38;0;now that im thinking i shoulda brought elise jungle always took my blue .. dont die rammus u have db lantern me gj nop oops swag low swag risky i also have lag, young sir swag;1;1;10
1;Thresh;enemy;17;00:01:11;00:27:41;0;rly LOL lol this rammus teamtwerk ik 0 box 50 kheb ignite LOL jukerino 70 hp lol nub need jinx ik had zelfs nog talisman im bad why do i die always;1;1;10
1;Ziggs;enemy;6;00:13:45;00:29:15;1;nice :D :D boom shakalaka!!! fucking scumbags blocked the lantern fou im playing with --- ms  oh god xD;1;1;10
2;Brand;ally;12;00:12:29;00:39:56;1;ty janna u really did help me alot when u ganked u came and stood there when elice killed me I shall report u for assisting enemy team and janna has 3/5 and only 6 farm what a noob worth got drake are u on any kind of drugs at the moment? janna muted and shitted on gg;2;2;100
2;Draven;ally;3;00:01:17;00:37:32;0;brand care with bliz ss lol;2;2;100
2;Elise;enemy;1;00:39:30;00:39:30;0;gg;2;2;100
2;Janna;offender;24;00:09:47;00:39:57;1;omg JUJUJUJU omg brand just uninstall lol yes is my fault u r totally retard and uskilled 03.Aug just uninstall lol dude play another shit my god brand hahahahahah flashed hahahahahha brand u r tarded due dude your mom and dad r brothers hahahahahaha well done team just leave the match pro premade hahahahahha u r so funny guys lulu is good the rest omg O M G gg wp;2;2;100
2;Lulu;ally;5;00:09:35;00:39:55;0;good gank brother scurbz yeah luck that you are alive janna muted/reported gege;2;2;100
2;Nocturne;ally;10;00:31:30;00:37:38;1;THIS DRAVEN --- did you know you can actually catch you axes draven janna muted/reported FARM MID DRAVEN GJ PLAY MORE ADC SERIOUSLY YOU ARE SO GOOD muted btw;2;2;100
2;Twisted Fate;enemy;18;00:05:58;00:39:55;0;re SS BOT DAMN ty elise .-. wake up elise noc ganked about 10 times mid i WON brand now...no 3 kills for him thanks to noc this is luck :) me? please def me and vayne blitz and elise bg;2;2;100
2;Vayne;enemy;1;00:28:41;00:28:41;0;nocturne on your back;2;2;100
2;Yasuo;enemy;4;00:14:36;00:39:56;0;nice walking jungler try to gank too elise reported pls gg;2;2;100
3;Amumu;enemy;1;00:08:11;00:08:11;0;thx;3;3;1000
3;Annie;ally;1;00:02:32;00:02:32;0;D:;3;3;1000
3;Cho'Gath;enemy;1;00:08:34;00:08:34;0;dr;3;3;1000
3;Riven;ally;7;00:02:16;00:18:42;0;reprt reprot nice ult mmu negerstun ggwp ezy lol wp exy;3;3;1000
3;Sejuani;enemy;1;00:17:00;00:17:00;0;no!!;3;3;1000
3;Xin Zhao;offender;16;00:02:16;00:18:36;1;gay trund noob team stop being pussy's and camp go rambo gg FEED THE PORO GUYS GG This heimer.. Wonder if our heimer every used his ult Report Heimerdinger dat flash into gath's stunm report dinger LOL WIN WICKED SICK JUST GO;3;3;1000
4;Annie;enemy;5;00:04:11;00:31:44;0;lol .. go on her :P xD i was fighting against a monster;4;4;10000
4;Brand;ally;34;00:00:24;00:33:06;1;who is supp ? okok no troll please he 's afk maybe yes usually mid don't help the blue no nice go suurrend surrend ty and report shaco 3 on mid it's loose u help bot stop ur jungler noob warded nice noob adc noob top noob jungler Nice annie u win bacause of ur team good varus 10 cs 1 cs/min varus 1 v5 xD gj riven ? ahhahaha report this team ty gg Wp BRONZE 50 smurf u kownw? known? u u don't have it's sure nice kah sic hahaha under the tower with --- HO U CAN4T KILL? hp* just 1/4 u are so good... kahsix useless nice kahsix look;4;4;10000
4;Ezreal;enemy;6;00:03:38;00:09:57;0;np np u can carry o0mg omg wtf leona why ?;4;4;10000
4;Kha'Zix;offender;54;00:00:09;00:33:10;1;so smart.... gl hf shaco is he lagged probs didnt join game brand help blue? maybe'? i need it smiteless usually he does lol and what is usally tnx varus warded gj dat olaf nice no mana YEAH we know you think that ll ahhh raging kid can't even speak proper english ah nice bf sword ll just ignore the twat brand complaining about the whole team except himself haha kid bronze 3 gj riven just ignore :D there is probably something wrong in his head becuz i really don't care i died there HAHAHHAHAHA no just not oh no a report im scared so obvious lolol bronze 50? said the bronze 3 lolol SURE still bad ah getting nercous? HAHA NOOOB lolz sic? can4t? ur getting nervous kid chill out take yah pills gj ah gtfo XD slowz gj gj gj xD ofc xD funny how they say win hi gj gg wp :D;4;4;10000
4;Leona;enemy;10;00:02:15;00:24:49;0;ss just farm ez :)+ fck sry sry  ez :( sy sry :D not so greedy now as team pls ALL MID pls;4;4;10000
4;Olaf;enemy;5;00:00:26;00:33:07;0;gl 6 hf to you aswell honor shaco pls cuz we all suck and he made us win hi xD OP Splitpush;4;4;10000
4;Riven;ally;6;00:00:30;00:12:47;0;shcao brand help ? stun was not rdy sry dont flame its only game not ur life;4;4;10000
4;Tryndamere;enemy;5;00:00:21;00:31:33;0;pls smitles smiteless ty annie xD;4;4;10000
4;Varus;ally;5;00:02:13;00:33:12;1;np gj fuck barrier stfu and play yourself solo bot rpeort shako;4;4;10000
5;Aatrox;enemy;9;00:00:47;00:32:41;0;my red!!! warwick help pls all mid !! ggggggggggggggggggggggggggggggggggggggggggggggggggggggggggggg all mid!!!! hacker kata and phanteon report for hacking gg wp;5;5;10001
5;Ashe;ally;15;00:00:19;00:27:22;1;where are you from? ty :) sry omw :) danke gleichfalls :) xDDDD trololol gj :D gj sry for ks hahahaha nice :3 pantheon wtf? fu not funny. thats sad.;5;5;10001
5;Darius;enemy;3;00:19:03;00:32:41;0;gg thx aatrox gg;5;5;10001
5;Ezreal;offender;15;00:01:04;00:26:56;0;ger nice skin fuuck teemo i hate this champ adc? warwick gj ashe faioill xd GG riven 0-11 pro, fial wooow;5;5;10001
5;Katarina;ally;2;00:01:14;00:27:02;0;y yo lol;5;5;10001
5;Riven;ally;1;00:01:08;00:01:08;0;Spain;5;5;10001
5;Talon;enemy;2;00:24:34;00:26:37;0;ks teemo mid;5;5;10001
5;Warwick;enemy;1;00:32:43;00:32:43;0;gg;5;5;10001
6;Diana;offender;42;00:02:10;00:19:16;1;lol gg lost ignite aswell i didnt flash gj wht is happening bot? lee counters wukong, still loosing top? this lee sucks OMFG SO NOOBS WORST TEAM EY lee sin counter wukong, loosing hard botlane sucks, this jungler is terrible gg so bad omfg so bad so bad so bad so fed wtf have u done look vayn 6 kills gg haha so fed xin. gg top and bot im the only one who win my lane a lvl 6 evelynn gg LOOK AT VAYNE so bad hahah so bd im ak worst team ever seen this vayne. u belong in bronze 5 look vayne hahaha bad i had 1-0 until u fed i won my lane then i took a look botlane HAHAHA haha vayne so bad;6;6;10002
6;Evelynn;ally;18;00:05:36;00:19:44;1;its called miniontax' TM have fun botlane diana vayne complains to much stay in school i cant kill him stfu diana so bad this diana flames and leaves 1-5 diana talks shiit and then you opned your  mouth and started feeding gj diana reported negative attitude to fed gg nice attackspeed vayne xD adc you know what that means end;6;6;10002
6;Katarina;enemy;20;00:03:18;00:20:13;0;gj gj best flash ever XD i mean ur flash ~_~ oh didnt u? LOL ty gj ss gj yep nop gj wp lol vayne score XD u can win XD gg wp XD;6;6;10002
6;Nidalee;ally;3;00:14:09;00:18:32;1;nboo diana stop chatting u are doing 1/67 1/6*;6;6;10002
6;Urgot;enemy;4;00:11:54;00:13:51;0;XD best combo eu dragon OMG XIN MOR e plz;6;6;10002
6;Vayne;ally;21;00:08:13;00:20:16;1;it's okay lol more ulti eve wtf gg surrend gg why mid is bot pro top pro mid pro jungler diana noob why is kata bot pro dian go and report surrend att pro no diana reported /surrender all report diana ty report diana negative;6;6;10002
6;Wukong;enemy;3;00:04:57;00:20:19;0;gj :) ss top gg wp;6;6;10002
6;Xin Zhao;enemy;18;00:00:41;00:19:59;1;cover smiteless blue pls ty gj push push puish puish brb damn u are bait by kata U are  bad sry xD Outplayed damn DARAPE huehuehuehue llulz;6;6;10002
6;Zyra;enemy;1;00:20:13;00:20:13;0;gg;6;6;10002
7;Amumu;enemy;17;00:03:26;00:46:44;1;lol -.- why he is at my jungle gj lol sorry what? riven not my faul! ashe donst speak loock your farm who had 4 kills serie? NICE wait yes BIG LAG !!!! FK RIOT -.- FUCKING ASHE GO HOME AND PLAY NROMAL NOOB xD baby :* gj garen!!!;7;7;10003
7;Ashe;enemy;45;00:03:57;00:48:55;1;damn fail crap need some ganks bot damn could have a kill stop taking my farm and set wards omg... bot is feed you don't know what a supp needs to do... wtf udyr is feed lol team is gig fail big* lol lux took it ye same in bot I said it already lux took my farm lol you saved me :p sry if I had farm I couldn't feed this is just the worst... lol I only get assists damn :( let me farm.... you are supp... you don't even too exhaust did you? took* wtf fail ye same here what? ok ty nida :D sry too fast =( yep :p defend pls lost;7;7;10003
7;Cho'Gath;ally;56;00:00:22;00:26:59;1;Who i feed? Who i feed? I have  --- ping i laag LAAG LAAAAAAAAG Np varus I save you varus and you double np :D cho good supp! but fuxking laagï¿½ mana b wait haha gj Lol fuckingg good combo :D loo team, cho is a  very good supp! i go full tank? gj kata nooo fail ult HAHAHAHAHAHAH sry varus xD i like it lol ASHE ULT gj Varus am I a good supp? i'm not bad! gj ll HAHAHAHA Fail! FAIL i'm small :'( FU gj Lol gj blue varus BLUE my pls --' VARUS Lol Gj FUCK PUSH OR I AFK my mother --' lol xDï¿½ --' happy? Varus and me good OMFG GAREN NOOOOOOOOOOOOOOOOOOOOOOOOOOB lol happy push  i afk 5 min LAG;7;7;10003
7;Garen;ally;105;00:00:47;00:49:01;1;no invade!! cho gath u lag not wat wat only 2 to blue wtf how haha let me kill omg fuck you srsly fucking you yes he only ks say you get the next kill and ks nice help lol udyr is a retard ss go out of mu lane om g ty niiice ss fuck you kata big fuckerr omg kata feed 7 deaths gg hahahahaha so feed u feed nida gj no ss she noob kata y ss 8* yes do that much better fuck kata assisting enemy team np varus kk i hate my mom so retardet can never play finish come here or i take the pc wtf wtf team this katarina feed nida 10 9 gg ahahah i feedx me 7 4 haha kk kk need back hahaha i noob ey feeders gj udyr fuck i love my build my farm ahaha the tower is save it is save ty motherfucekrr all go baron baro n wait for me omg gj back hehe wow i hate ashe omg varus stop farm thats my farm reproted full build!!! :D kata feeding 16 deaths g g loool this kata feeing 17 deaths reprot in feeding fuck you feed udyr pls report kata ty and you feed much reported and writed and?++ you feed more .. kata noob end ks noob;7;7;10003
7;Katarina;offender;81;00:01:07;00:49:02;1;WATH ? ? And ? AND SHUT UP stop and you use your flash gj let kill omg np ty udyr for come and kill surre ? ok i come kill you i lag fuck you lol fuck you nooob nida and fuck udyr for ks in gank yes ok noob plz report udyr for ks in gank fr ? nida ? ahaha 3  hp gj omg udyr no shut up i don't have feed nida shut up or leave fuck kkkkk nooob 4vs1 i leave ok i don't help team jungler have ks all my kill sry cho why fuck ? udyr help mid report garen omg report garen solo omg garen wtf OMG panta !! no just noob team omg omg fucking noob ulti ashe back garen and def mid plz come with team ok ? omg lux ap garen ty help this def garen gj gj we can win omg garen wtf ? 1vs1 nida ? luck =) gj ^gj fuck noob gjh varus good 5vs1 fuckkkkkkk come 1vs1 full life omg udyr omg nooob amumu report you ks kill yes gjh garen you go solo top and no help team 4vs5 look udyr lol ok def !!! omg noob udyr gg shut up;7;7;10003
7;Lux;enemy;12;00:13:50;00:48:16;1;big nooob u areafuck noobshut up ashe lux what nooob riven wat are u doing 03.Nov big noobs and very good supp andi stronger than u nice wait us fail;7;7;10003
7;Nidalee;enemy;54;00:00:32;00:49:01;1;you mean bot lane? mid or top?? me whait whait what -.- omg ty ty kata hah i wanna see that hah nice kill haha got you i'm a cat playing against kat yay blue buff hah what happen XD noonon you don't kill me whit out me killing you :D swe udyr ? and? lag WTF they split puch riven cepp going top :D ASHE STOP FEED :D YEAH HELL YEAH YES YES hah cho i like your style sry OMG LAG STUPID FUCKING LAG RIOT STOP LAGING ashe omg faster next time they got baron i'll def riven stay spawn yes shit all back they live all mid fast win duck riven you have high dmg soo puch top lane a hell mutch you can sister GG wp GG wp bg;7;7;10003
7;Riven;enemy;38;00:07:00;00:42:30;1;is not possible gank ? hard retard .............................................. you not say play jungle !! go play tetris amumu ok i go feed garen 0 gank noob .... reeport amumu plz omg amumu you dont say play jungle we loose fault amumu fuck i dont go noob jungle you speak ? look your farm for adc just surr garen lvl 12 me 8 ty amumu for 0 gank top nice ks lux ? nice ulti only ks xd focus me ched up me big retard fauld 0 gank top fauld jungle 0 gank garen 12 gank nice help ched up omg amumu 0 gank top gare have 12 gank is normal me retard !! garen* omg lag Oo omg ashe :( i dead for you ok;7;7;10003
7;Udyr;ally;38;00:00:28;00:49:00;1;invade ok? KATA -.- your runes 0armor 0magic resist garen Garen that was failed gj sry next time kata ? gj sry kata i helpp mid lol pls report kata for feed kata you are the noob you lost vs. nida np garen this is your kill chill gj np drake ok TEAM GG im so OP GG lol wtf shut Up kaza you suck so hard pls report my team i have 17 kills XD ok all def they have baron pls report kata for flame and feed gg;7;7;10003
7;Varus;ally;21;00:04:08;00:45:12;1;gj gj ty gj gj ty for help bot noob kata you feed seven death you feed ty garen fuk team noob i wont help you any more no more help you fed noob you push like noob, feed like pigs , learn to def before look the towe i destroy top and bot, right and left now mid what do you if we let them come why not let them come ??? they have baron , you have varus;7;7;10003
8;Lee Sin;enemy;8;00:02:11;00:28:47;0;ty seems to be warded ty damn i coudnt cast q why dindt you attak? you got so much range still just stand in bush yes, no wards from our sup;8;8;10004
8;Leona;enemy;16;00:21:16;00:35:45;1;"you could come and help 22 min 4 bot are you blind? no wards? ffs xerath you've not better score riven you cant even teamfight 1v5 really fen riven your score says that ""my team have only assists"" oh god riven you flame as girl in normal im relax about games it doesnt make me nervous";8;8;10004
8;Miss Fortune;ally;11;00:00:26;00:35:55;0;report teemo pls instalock troll? rly? we havent mid and top Err:511 for? because top useless bot own we play 3 vs5(i lux and noc bg;8;8;10004
8;Nocturne;ally;3;00:08:27;00:13:18;0;ss top yes Y;8;8;10004
8;Orianna;enemy;14;00:21:16;00:35:47;0;i died 2 times on bot and got 2 kills ahaha no and no reaction at all and u? i will report u for flame i play adc oriana if i didnt notice so? should i report u now? this guy just dont know;8;8;10004
8;Riven;ally;31;00:00:45;00:35:08;1;"lol hahahahha wtf that mf troll ^^ funny guy lol that skill this noc -.- gtfo junsgle seriously ? that ult noc gg wp this noc is so useless ^^ hahahhahahah for sure ^^ gj ^^ this noc ^^ riven useless = y for sure hahah ward nice :D LOL more items then riven useless ? HAHAHHAHAHAHA hahah that low elo play ... if u cant carry as riven if u are feed so hard hahhah i dont even got riven :D best joke euw HAHAH and that is a ""high elo player haha omg that low elo excuse ^^";8;8;10004
8;Riven;enemy;26;00:09:33;00:35:26;1;we have no bot me too i dont flame bot but they troll ok next time bro 1 hp you yeah report our troll bot and i report your troll you can see gj again pfff XDDDDDD report that epic noob player why you play at lol seriously go play tetris so fed you feed them look score and say who is useless riven we play 2vs5 i cant win 1vs5 sorry for that more than our bot lane my bot troll hard and feed like hell so... dont say you are good because you get carried by a feeded mf yers yes have our bot on your team and you'll say other thing;8;8;10004
8;Teemo;offender;14;00:00:50;00:33:45;0;not rly haha let them fmale no jungler we have no jungler true but the do 1 kill and my jugnel just flames luck more pls pls i know but can you report nocturne pls ? NOW YOU ARE YRE COMING BARON ATTACKED ME ï¿½ï¿½1 how much gold i give ? 50 gold ?;8;8;10004
8;Xerath;enemy;20;00:00:32;00:33:44;1;? ty Nice try gj lee nice dodge Why babysit ? 6 gank Riven so noob ? omg lee Noob omg lle noob i ping you nice feed mf bot go bot no mid noob y Y You ks Riven ?;8;8;10004
9;Akali;enemy;6;00:00:23;00:49:21;0;we are afk nice dat flash :D wp ^^ gg;9;9;10005
9;Darius;ally;3;00:00:31;00:25:53;0;premade too ^^ hooooo xD boooou;9;9;10005
9;Jax;enemy;6;00:00:33;00:49:22;0;fr ? cool ah xp :pd: GG WP;9;9;10005
9;Rengar;enemy;4;00:33:20;00:49:21;0;lol dsl xD gg;9;9;10005
9;Veigar;ally;7;00:00:28;00:49:16;0;"ok lvl ?? 19 :p ^^"" xD ok :p";9;9;10005
9;Warwick;offender;2;00:13:33;00:32:18;0;chance :p tg;9;9;10005
10;Anivia;enemy;4;00:05:26;00:19:40;0;take this wave rengar ill solo the blue rengar LOl gotq;10;10;10006
10;Blitzcrank;ally;16;00:10:16;00:19:43;0;no matter what you wont kill her second time i grabbed unter turret ofc was so? im not you are trying to trade them me for what? yeah for what? just explain your reasons she wasnt 1 hit when i pulled and you came whole lane just to feed them so;10;10;10006
10;Caitlyn;enemy;6;00:00:12;00:17:06;0;many mesos have uydr gj yes, :) UHEHUEHUE yalla gg ahi CAIT VS 5;10;10;10006
10;Elise;ally;1;00:03:55;00:03:55;0;trying to kill me;10;10;10006
10;Janna;enemy;21;00:00:44;00:19:51;0;i guess they might invade us outplayed. udyr no flash guys same bot lane. it was 2 obvious tbh but 2 greedy river warded vladiimir no ignite WORTH. my god vlad use both summs for kill me.. lol no assist why cait :( i hate u!! can we dragon? udyr top blitz afk? idd WORTH! :D 1 min dragon report that troll please. i will GG WP;10;10;10006
10;Jinx;ally;9;00:01:00;00:13:30;0;omw omg tornado :( vlad omg ye, and turret wasn't hitting her no it wasn't afk blitz is good blitz he is saying, he isn't, but his gameplay says it all;10;10;10006
10;Renekton;enemy;1;00:11:44;00:11:44;0;both flashed;10;10;10006
10;Udyr;offender;28;00:00:51;00:19:27;1;wut ty they do my red? kk wut was he doing coming round vlad lolz lol she wasnt getting hit though u grabbed her and it wasnt hitting her it was lol they had minoins it doesnt auto attack her when ther lol lol this vlad mid dunno hard to win peoples lanes for them if you'd waited you wouldnt have got killed like level 3 but you kept going in for CS and trading awfully just report vlad and blitz lol you're shit and you were like afk in lane and pulling cait to turret when jinx was 1 auto from dying seemed like a good ideA?;10;10;10006
10;Vladimir;ally;10;00:02:27;00:15:37;1;ward CANT DO SHIT ss ss care ff IDIOTS RUN FROM A 3v2?!?!? WTF?!?!? udyr you did shit;10;10;10006
11;Darius;enemy;4;00:07:51;00:37:05;0;y warded i ult.... ggwp;11;11;10007
11;Dr. Mundo;ally;41;00:01:25;00:37:33;1;yo wtf are u doing wake up zed it was kill me stop diving everything zed ffs i got double kill bot with it i have to b well we miss all team respond zed ??????????? only ww can bethere What trash who is the trash need to group come mid their nihib will respawn soon --- baon BARON COME just burst it go COME TO US just let them get inhibitor he is the one destroying our teamwork tho k we are still 2 barons up just group bot or top? k come then END end report zed biggest idiot Srsly;11;11;10007
11;Jinx;ally;10;00:04:51;00:32:46;0;sry ww ult and dead ty udyr -.- focus vayne not ww and thresh can we go as team? gg all mid pls now;11;11;10007
11;Nidalee;enemy;31;00:00:22;00:36:52;1;just build ad and gg armor* :D pots op no flash mid ty that luck so feed bot :S for can carry :S easy mid 1v2 and I won u hard funny get carryed that zed xD why stay? omg :S we lost game here in that suicide build armor oh my god that feed for real why udyr so feed? dont go in like a  crazy they are doing baron darius why? dont complain u ww why fu go in? and dont just def? omfg gg;11;11;10007
11;Taric;ally;52;00:01:26;00:37:30;0;wow zed if you don't let me use my targons you can solo this lane seriously jinx do you know how fucking annoying it is buying an item and not being able to use it if you don't want me giving you free gold then i may aswell sell this and get an ancient coin can you try csing a little better so you don't fall too far behind you getting a randuins mundo? you're right taric isn't hard rofl dragon in 1 min i mean 2 wow jinx that was wow the bush was next to you just break vision instead of flashing why are we letting them get free turrets? w.e taric does so much damage the fuck] i think i can 1v1 nidalee try again if you want help i can give you the answer vayne why is this so hard to win w.e zed wasn't the one who threw the game js no you do that by going in 2v5 it's like you want to throw why stay for so long we got an inhib so leave don't stay what are we going to gain from staying nothing i don't really care you're not playing perfect either really? so im doing nothing right useless barons it seems top gg;11;11;10007
11;Thresh;enemy;1;00:09:59;00:09:59;0;vayne how did you die?;11;11;10007
11;Udyr;ally;24;00:01:22;00:37:32;1;hahahahahhaa this puss darius that w and flash omfg dont take it im way better with it idd that zed ya he's op useless Darius we are baron we go baron and what u do noob ty for this zed riot ty zed never groups i am the one to carry this but cant without zed i didnt say that gg report zed please;11;11;10007
11;Vayne;enemy;7;00:13:00;00:36:54;1;fkin retard this trersh is like the most retarded guy on planet cya nerd say thx to this trash for carrying u tresh trash reporet tresh pls;11;11;10007
11;Warwick;enemy;28;00:06:33;00:37:12;0;dont die wait u got a spirit stone? red gank mid dont push gj coming around real haha oh cmon peeps we can still win real why are you top defend the inhib? like it matters why u chase oom im b just get some armor everyone hit your spears bro shouldnt have don that ur correct just defend GET BACK wtf why on earth are you still there that was bad but im not losing the game mid ggwp? u serious?;11;11;10007
